{
  "$schema": "http://json-schema.org/draft-06/schema#",
  "id": "http://hl7.org/fhir/json-schema/DiagnosticReport",
  "description": "The findings and interpretation of diagnostic tests performed on patients, groups of patients, devices, and locations, and/or specimens derived from these. The report includes clinical context such as requesting and provider information, and some mix of atomic results, images, textual and coded interpretations, and formatted representation of diagnostic reports.",
  "type": "object",
  "required": ["resourceType", "code"],
  "properties": {
    "resourceType": { "const": "DiagnosticReport" },
    "id": { "type": "string", "description": "Logical id of this artifact" },
    "_id": { "type": "string", "description": "MongoDB primary key" },
    "meta": { "type": "object", "properties": { "versionId": { "type": "string" }, "lastUpdated": { "type": "string" }, "source": { "type": "string" }, "profile": { "type": "array", "items": { "type": "string" } }, "security": { "type": "array", "items": { "type": "object", "properties": { "system": { "type": "string" }, "code": { "type": "string" }, "display": { "type": "string" } } } }, "tag": { "type": "array", "items": { "type": "object", "properties": { "system": { "type": "string" }, "code": { "type": "string" }, "display": { "type": "string" } } } } } },
    "implicitRules": { "type": "string" },
    "language": { "type": "string" },
    "text": { "type": "object", "properties": { "status": { "type": "string" }, "div": { "type": "string" } } },
    "contained": { "type": "array", "items": { "type": "object" } },
    "extension": { "type": "array", "items": { "type": "object" } },
    "modifierExtension": { "type": "array", "items": { "type": "object" } },
    "identifier": { "type": "array", "items": { "type": "object", "properties": { "use": { "type": "string" }, "system": { "type": "string" }, "value": { "type": "string" } } } },
    "basedOn": { "type": "array", "items": { "type": "object", "properties": { "reference": { "type": "string" }, "display": { "type": "string" } } } },
    "status": { "type": "string", "enum": ["registered", "partial", "preliminary", "final", "amended", "corrected", "appended", "cancelled", "entered-in-error", "unknown"] },
    "category": { "type": "array", "items": { "type": "object", "properties": { "coding": { "type": "array", "items": { "type": "object", "properties": { "system": { "type": "string" }, "code": { "type": "string" }, "display": { "type": "string" } } } }, "text": { "type": "string" } } } },
    "code": { "type": "object", "properties": { "coding": { "type": "array", "items": { "type": "object", "properties": { "system": { "type": "string" }, "code": { "type": "string" }, "display": { "type": "string" } } } }, "text": { "type": "string" } } },
    "subject": { "type": "object", "properties": { "reference": { "type": "string" }, "display": { "type": "string" } } },
    "encounter": { "type": "object", "properties": { "reference": { "type": "string" }, "display": { "type": "string" } } },
    "effectiveDateTime": { "type": "string" },
    "effectivePeriod": { "type": "object", "properties": { "start": { "type": "string" }, "end": { "type": "string" } } },
    "issued": { "type": "string" },
    "performer": { "type": "array", "items": { "type": "object", "properties": { "reference": { "type": "string" }, "display": { "type": "string" } } } },
    "resultsInterpreter": { "type": "array", "items": { "type": "object", "properties": { "reference": { "type": "string" }, "display": { "type": "string" } } } },
    "specimen": { "type": "array", "items": { "type": "object", "properties": { "reference": { "type": "string" }, "display": { "type": "string" } } } },
    "result": { "type": "array", "items": { "type": "object", "properties": { "reference": { "type": "string" }, "display": { "type": "string" } } } },
    "imagingStudy": { "type": "array", "items": { "type": "object", "properties": { "reference": { "type": "string" }, "display": { "type": "string" } } } },
    "media": { "type": "array", "items": { "type": "object", "properties": { "comment": { "type": "string" }, "link": { "type": "object", "properties": { "reference": { "type": "string" }, "display": { "type": "string" } } } } } },
    "conclusion": { "type": "string" },
    "conclusionCode": { "type": "array", "items": { "type": "object", "properties": { "coding": { "type": "array", "items": { "type": "object", "properties": { "system": { "type": "string" }, "code": { "type": "string" }, "display": { "type": "string" } } } }, "text": { "type": "string" } } } },
    "presentedForm": { "type": "array", "items": { "type": "object", "properties": { "contentType": { "type": "string" }, "language": { "type": "string" }, "data": { "type": "string" }, "url": { "type": "string" }, "size": { "type": "integer" }, "hash": { "type": "string" }, "title": { "type": "string" }, "creation": { "type": "string" } } } }
  }
}
